{"profile_id":"MWM-CP-EXAMPLE","profile_version":"0.1.0","volume_id":"VOL-EXAMPLE","chapter_type":"research_chapter","stage":"intake","publisher_profile":null,"required_components":[],"conditional_rules":[{"rule_id":"CPR-COND-FIGURES","condition":"callout_or_asset_exists","authority_id":"MWM-DEC-1","owner":"volume editor","stage_due":"production_handoff","release_effect":"hold"}],"optional_components":[],"delegated_owners":[],"accessibility_target":null,"release_signatory_role":"volume editor","effective_date":"2026-08-13","approved_by":"MWM editorial owner","decision_log_id":"MWM-DEC-1"}
